{
  "schema_version": "1.0.0",
  "id": "id-example-0001",
  "source_uri": "https://example.org/artifact",
  "source_title": "Example public source",
  "source_system": "source_system-example-0001",
  "source_version": "1.0.0",
  "retrieved_at": "2026-07-26T12:00:00Z",
  "content_digest": "sha256:aaaaaaaaaaaaaaaaaaaaaaaaaaaaaaaaaaaaaaaaaaaaaaaaaaaaaaaaaaaaaaaa",
  "locator": {},
  "classification": "public",
  "rights_id": "rights_id-example-0001"
}
